{
  "schema_version": "1.1.0",
  "card_id": "C0001",
  "concept_version": "1.0.0",
  "status": "REVIEW_READY",
  "term": {
    "original": "saudade",
    "language_code": "pt-BR",
    "language_name": "Português (Brasil)",
    "ipa": "/sawˈda.dʒi/"
  },
  "experience_type": "mixed_experience",
  "front": {
    "poetic_line": "멀리 있어도 마음 안에서 계속 가까운 것들.",
    "scene": "창가의 빈 의자 옆에 접힌 편지가 놓여 있고, 창밖으로 흐릿한 수평선이 이어진다.",
    "reflection_question": "지금 떠올려도 좋은, 조금 멀어진 무언가가 있나요?"
  },
  "meaning": {
    "verified_definition": "부재하거나 멀어진 사람·장소·시간·대상에 대한 애정 어린 기억과 다시 가까이하고 싶은 마음이 상실감과 함께 겹쳐 나타나는 포르투갈어권의 정서 경험.",
    "usage_context": "사전과 연구에서는 사람, 장소, 지나간 시간이나 익숙한 대상의 부재와 관련된 기억·그리움과 상실감이 함께 나타나는 맥락으로 설명된다.",
    "cultural_context": "포르투갈 문화의 중요한 정서적 표상으로 자주 논의되지만 포르투갈에만 독점적으로 존재하는 감정으로 단정하지 않는다. 브라질을 포함한 포르투갈어권에서도 일상적으로 쓰이며, '번역 불가능'이라는 표현보다는 문화적으로 깊게 자리 잡아 다른 언어의 한 단어와 완전히 겹치지 않는 개념으로 다루는 편이 안전하다."
  },
  "comparisons": {
    "ko": {
      "near_terms": [
        "그리움",
        "향수"
      ],
      "difference_note": "그리움이나 향수와 겹치지만, saudade는 부재한 대상에 대한 애정 어린 기억·다시 가까이하고 싶은 마음·상실감이 함께 묶이는 포르투갈어권의 쓰임을 가진다. 완전한 일대일 대응어로 보지 않는다."
    },
    "en": {
      "near_terms": [
        "longing",
        "yearning",
        "nostalgia",
        "missing"
      ],
      "difference_note": "영어의 여러 표현이 일부 의미를 나누어 담지만, 어느 하나를 saudade의 완전한 번역어로 취급하지 않는다."
    },
    "zh": {
      "near_terms": [
        "思念",
        "怀念"
      ],
      "difference_note": "思念·怀念은 사람이나 지나간 대상을 그리워하고 기억하는 의미에서 가깝지만, saudade의 문화적 사용 범위 전체와 동일하다고 보지 않는다."
    },
    "ja": {
      "near_terms": [
        "恋しさ",
        "懐かしさ"
      ],
      "difference_note": "恋しさ는 떨어진 사람·장소·사물을 강하게 그리는 쪽에, 懐かしさ는 익숙했던 과거를 떠올리는 쪽에 가까워 각각 일부 면을 비춘다. 두 표현 모두 saudade와 완전히 같지는 않다."
    }
  },
  "semantic_tags": [
    "absence",
    "attachment",
    "distance",
    "longing",
    "memory",
    "loss"
  ],
  "relations": {
    "similar_to": [],
    "partially_overlaps": [],
    "contrasts_with": [],
    "broader_than": [],
    "narrower_than": [],
    "often_confused_with": []
  },
  "reference_ids": [
    "R0001",
    "R0002",
    "R0003",
    "R0004",
    "R0005",
    "R0006",
    "R0007",
    "R0008",
    "R0009",
    "R0010",
    "R0011",
    "R0012"
  ],
  "verification": {
    "status": "VERIFIED",
    "last_reviewed_at": "2026-09-16",
    "lexical_source_count": 2,
    "scholarly_source_count": 3
  },
  "assets": {
    "illustration_asset_id": "A0001",
    "share_asset_id": "A0002",
    "audio_asset_id": "A0003",
    "alt_text": "창가의 빈 의자 옆 작은 탁자에 접힌 편지가 놓여 있고, 멀리 흐릿한 수평선이 보이는 차분한 선화."
  }
}
